,restaurant,item,ms_item,matched_2021,new_item_2022,menu_item_id,food_category,item_description,serving_size,serving_size_text,serving_size_unit,serving_size_household,calories,total_fat,saturated_fat,trans_fat,cholesterol,sodium,carbohydrates,dietary_fiber,sugar,protein,potassium,notes,calories_text,total_fat_text,saturated_fat_text,trans_fat_text,cholesterol_text,sodium_text,carbohydrates_text,dietary_fiber_text,sugar_text,protein_text,bestseller
539,kfc,8 Pc. Chicken Only,Chicken Littles - Honey BBQ,1,0,935209,Sandwiches,"Chicken Littles - Honey BBQ, Sandwiches",,,,,320,15.0,2.5,0.0,30.0,680,31.0,1.0,7.0,14.0,,,,,,,,,,,,,0
540,kfc,12 Pc. Chicken Only,Dr Pepper (12 fl oz),1,0,127536,Beverages,"Dr Pepper (12 fl oz), Beverages",12.0,,fl oz,,140,0.0,0.0,0.0,0.0,45,39.0,0.0,38.0,0.0,,,,,,,,,,,,,0
541,kfc,16 Pc. Chicken Only,Dr Pepper (16 fl oz),1,0,18542,Beverages,"Dr Pepper (16 fl oz), Beverages",16.0,,fl oz,,190,0.0,0.0,0.0,0.0,60,52.0,0.0,51.0,0.0,,,,,,,,,,,,,0
542,kfc,Chicken Sandwich,Spicy Chicken Sandwich,1,0,947687,Sandwiches,"Spicy Chicken Sandwich, Sandwiches",,,,,620,33.0,4.0,0.0,85.0,2140,49.0,1.0,6.0,34.0,,,,,,,,,,,,,0
543,kfc,Mashed Potatoes,Mashed Potatoes,1,0,18369,Appetizers & Sides,"Mashed Potatoes, Homestyle Sides (Individual)",,,,,110,3.5,0.5,0.0,0.0,330,17.0,1.0,0.0,2.0,,,,,,,,,,,,,0
544,kfc,Mashed Potatoes,Mashed Potatoes,1,0,18369,Appetizers & Sides,"Mashed Potatoes, Homestyle Sides (Individual)",,,,,110,3.5,0.5,0.0,0.0,330,17.0,1.0,0.0,2.0,,,,,,,,,,,,,0
545,kfc,Secret Recipe Fries,Secret Recipe Fries,1,0,947684,Fried Potatoes,"Secret Recipe Fries, Homestyle Sides (Individual)",,,,Individual,320,15.0,2.0,0.0,0.0,1100,41.0,3.0,0.0,5.0,,,,,,,,,,,,,0
546,kfc,Secret Recipe Fries,Secret Recipe Fries,1,0,947684,Fried Potatoes,"Secret Recipe Fries, Homestyle Sides (Individual)",,,,Individual,320,15.0,2.0,0.0,0.0,1100,41.0,3.0,0.0,5.0,,,,,,,,,,,,,0
547,kfc,Baked Beans,BBQ Baked Beans,1,0,18419,Appetizers & Sides,"BBQ Baked Beans, Homestyle Sides (Individual)",,,,,190,1.0,0.0,0.0,0.0,650,34.0,7.0,15.0,11.0,,,,,,,,,,,,,0
548,kfc,Baked Beans,BBQ Baked Beans,1,0,18419,Appetizers & Sides,"BBQ Baked Beans, Homestyle Sides (Individual)",,,,,190,1.0,0.0,0.0,0.0,650,34.0,7.0,15.0,11.0,,,,,,,,,,,,,0
549,kfc,Sweet Kernel Corn,Sweet Kernel Corn,1,0,1932,Appetizers & Sides,"Sweet Kernel Corn, Homestyle Sides (Individual)",,,,,70,0.5,0.0,0.0,0.0,0,16.0,2.0,2.0,2.0,,,,,,,,,,,,,0
550,kfc,Sweet Kernel Corn,Sweet Kernel Corn,1,0,1932,Appetizers & Sides,"Sweet Kernel Corn, Homestyle Sides (Individual)",,,,,70,0.5,0.0,0.0,0.0,0,16.0,2.0,2.0,2.0,,,,,,,,,,,,,0
551,kfc,Green Beans,Green Beans,1,0,1928,Appetizers & Sides,"Green Beans, Homestyle Sides (Individual)",,,,,25,0.0,0.0,0.0,0.0,300,5.0,3.0,1.0,1.0,,,,,,,,,,,,,0
552,kfc,Green Beans,Green Beans,1,0,1928,Appetizers & Sides,"Green Beans, Homestyle Sides (Individual)",,,,,25,0.0,0.0,0.0,0.0,300,5.0,3.0,1.0,1.0,,,,,,,,,,,,,0
553,kfc,Mac & Cheese,Macaroni & Cheese,1,0,1991,Appetizers & Sides,"Macaroni & Cheese, Homestyle Sides (Individual)",,,,,140,6.0,1.5,0.0,,590,17.0,1.0,2.0,5.0,,,,,,,,,,,,,0
554,kfc,Mac & Cheese,Macaroni & Cheese,1,0,1991,Appetizers & Sides,"Macaroni & Cheese, Homestyle Sides (Individual)",,,,,140,6.0,1.5,0.0,,590,17.0,1.0,2.0,5.0,,,,,,,,,,,,,0
555,kfc,Iced Tea,Lipton Brisk Sweet Iced Tea (16 fl oz),1,0,18490,Beverages,"Lipton Brisk Sweet Iced Tea (16 fl oz), Beverages",16.0,,fl oz,,110,0.0,0.0,0.0,0.0,65,29.0,0.0,29.0,0.0,,,,,,,,,,,,,0
556,kfc,Strawberry Lemonade,Strawberry Lemonade (20 fl oz),1,0,135310,Beverages,"Strawberry Lemonade (20 fl oz), Beverages",20.0,,fl oz,,170,0.0,0.0,0.0,0.0,130,45.0,0.0,44.0,0.0,,,,,,,,,,,,,0
557,kfc,Strawberry Lemonade,Strawberry Lemonade (20 fl oz),1,0,135310,Beverages,"Strawberry Lemonade (20 fl oz), Beverages",20.0,,fl oz,,170,0.0,0.0,0.0,0.0,130,45.0,0.0,44.0,0.0,,,,,,,,,,,,,0
558,kfc,"8 Pc. Chicken, 2 Large Mashed Potatoes, Large Gravy, Large Coleslaw & 4 Biscuits",Mashed Potatoes With Gravy,1,0,1675,Appetizers & Sides,"Mashed Potatoes With Gravy, Homestyle Sides (Individual)",,,,,130,4.5,1.0,0.0,0.0,520,20.0,1.0,0.0,3.0,,,,,,,,,,,,,0
559,kfc,"8 Pieces Extr Crispy Chicken  with 2 Large Mashed Potatoes, Large Gravy, Large Coleslaw & 4 Biscuits",Mashed Potatoes With Gravy,1,0,1675,Appetizers & Sides,"Mashed Potatoes With Gravy, Homestyle Sides (Individual)",,,,,130,4.5,1.0,0.0,0.0,520,20.0,1.0,0.0,3.0,,,,,,,,,,,,,0
560,kfc,"12 Pieces of Extra Crispy Tenders with 2 Large Mashed Potatoes, Large Gravy, Large Coleslaw & 4 Biscuits",Mashed Potatoes With Gravy,1,0,1675,Appetizers & Sides,"Mashed Potatoes With Gravy, Homestyle Sides (Individual)",,,,,130,4.5,1.0,0.0,0.0,520,20.0,1.0,0.0,3.0,,,,,,,,,,,,,0
561,kfc,3 Pc. Chicken Box,Chicken Littles - Honey BBQ,1,0,935209,Sandwiches,"Chicken Littles - Honey BBQ, Sandwiches",,,,,320,15.0,2.5,0.0,30.0,680,31.0,1.0,7.0,14.0,,,,,,,,,,,,,0
562,kfc,Crispy Colonel Combo with 2 Sides,Nashville Hot Extra Crispy Chicken Whole Wing,1,0,180584,Entrees,"Nashville Hot Extra Crispy Chicken Whole Wing, Nashville Hot Chicken",,,,,290,25.0,4.0,0.0,45.0,520,6.0,1.0,1.0,10.0,,,,,,,,,,,,,0
563,kfc,KFC Famous Bowl,KFC Famous Bowl,1,0,1289,Entrees,"KFC Famous Bowl, Pot Pie and Bowls",,,,,740,35.0,6.0,0.0,45.0,2350,81.0,6.0,2.0,26.0,,,,,,,,,,,,,0
564,kfc,Pot Pie,Chicken Pot Pie,1,0,1286,Entrees,"Chicken Pot Pie, Pot Pie and Bowls",,,,,720,41.0,25.0,0.0,80.0,1750,60.0,7.0,5.0,26.0,,,,,,,,,,,,,0
565,kfc,$10 Popcorn Nuggets,Popcorn Nuggets - Kids,1,0,1267,Entrees,"Popcorn Nuggets - Kids, Popcorn Nuggets",,,,,290,19.0,2.5,0.0,30.0,870,19.0,1.0,0.0,13.0,,,,,,,,,,,,,0
566,mcdonalds,Medium French Fries,Medium French Fries,1,0,1597,Fried Potatoes,"Medium French Fries, French Fries",117.0,,g,,380,19.0,2.5,0.0,0.0,270,48.0,5.0,0.0,4.0,,,,,,,,,,,,,1
567,mcdonalds,10 pc. Chicken McNuggets,Chicken McNuggets (10 piece),1,0,936136,Entrees,"Chicken McNuggets (10 piece), Chicken McNuggets/Chicken Selects Premium Breast Strips/Sauces",162.0,,g,,470,30.0,5.0,0.0,65.0,900,30.0,2.0,0.0,22.0,,,,,,,,,,,,,1
568,mcdonalds,Double Cheeseburger,Double Cheeseburger,1,0,176,Burgers,"Double Cheeseburger, Sandwiches",165.0,,g,,440,23.0,11.0,1.5,80.0,1150,34.0,2.0,7.0,25.0,,,,,,,,,,,,,0
569,mcdonalds,McChicken,McChicken,1,0,387,Sandwiches,"McChicken, Sandwiches",143.0,,g,,360,16.0,3.0,0.0,35.0,830,40.0,2.0,5.0,14.0,,,,,,,,,,,,,0
571,mcdonalds,Cheeseburger,Cheeseburger,1,0,175,Burgers,"Cheeseburger, Sandwiches",114.0,,g,,300,12.0,6.0,0.5,40.0,750,33.0,2.0,6.0,15.0,,,,,,,,,,,,,0
572,mcdonalds,6 pc. Chicken McNuggets,Chicken McNuggets (6 piece),1,0,936137,Entrees,"Chicken McNuggets (6 piece), Chicken McNuggets/Chicken Selects Premium Breast Strips/Sauces",97.0,,g,,280,18.0,3.0,0.0,40.0,540,18.0,1.0,0.0,13.0,,,,,,,,,,,,,0
574,mcdonalds,Big Mac,Big Mac,1,0,180,Burgers,"Big Mac, Sandwiches",214.0,,g,,540,29.0,10.0,1.5,75.0,1040,45.0,3.0,9.0,25.0,,,,,,,,,,,,,1
578,mcdonalds,Double Quarter Pounder with Cheese Meal,Double Quarter Pounder with Cheese,1,0,182,Burgers,"Double Quarter Pounder with Cheese, Sandwiches",279.0,,g,,740,42.0,19.0,2.5,155.0,1380,40.0,3.0,9.0,48.0,,,,,,,,,,,,,0
579,mcdonalds,20 pc. Chicken McNuggets,Chicken McNuggets (4 piece),1,0,180252,Entrees,"Chicken McNuggets (4 piece), Chicken McNuggets/Chicken Selects Premium Breast Strips/Sauces",65.0,,g,,190,12.0,2.0,0.0,25.0,360,12.0,1.0,0.0,9.0,,,,,,,,,,,,,0
580,mcdonalds,OREO McFlurry,Snack Size McFlurry with OREO Cookies,0,1,953309,Desserts,"Snack Size McFlurry with OREO Cookies, Desserts/ Shakes",190.0,,g,,340,12.0,6.0,0.0,30.0,200,53.0,2.0,43.0,8.0,,,,,,,,,,,,,0
581,mcdonalds,Medium Coke,Diet Coke (Small),1,0,19272,Beverages,"Diet Coke (Small), Beverages",16.0,,fl oz,,0,0.0,0.0,0.0,0.0,20,0.0,0.0,0.0,0.0,,,,,,,,,,,,,0
582,mcdonalds,40 pc. Chicken McNuggets,Chicken McNuggets (4 piece),1,0,180252,Entrees,"Chicken McNuggets (4 piece), Chicken McNuggets/Chicken Selects Premium Breast Strips/Sauces",65.0,,g,,190,12.0,2.0,0.0,25.0,360,12.0,1.0,0.0,9.0,,,,,,,,,,,,,0
584,mcdonalds,Quarter Pounder with Cheese Meal,Quarter Pounder with Cheese,1,0,178,Burgers,"Quarter Pounder with Cheese, Sandwiches",198.0,,g,,510,26.0,12.0,1.5,90.0,1190,40.0,3.0,9.0,29.0,,,,,,,,,,,,,0
585,mcdonalds,Deluxe McCrispy Meal,Angus Deluxe Snack Wrap,0,1,953237,Sandwiches,"Angus Deluxe Snack Wrap, Sandwiches",170.0,,g,,410,25.0,10.0,1.5,75.0,990,27.0,2.0,3.0,20.0,,,,,,,,,,,,,0
586,mcdonalds,Double Quarter Pounder with Cheese Meal,Double Quarter Pounder with Cheese,1,0,182,Burgers,"Double Quarter Pounder with Cheese, Sandwiches",279.0,,g,,740,42.0,19.0,2.5,155.0,1380,40.0,3.0,9.0,48.0,,,,,,,,,,,,,0
587,mcdonalds,Quarter Pounder with Cheese Deluxe Meal,Quarter Pounder with Cheese,1,0,178,Burgers,"Quarter Pounder with Cheese, Sandwiches",198.0,,g,,510,26.0,12.0,1.5,90.0,1190,40.0,3.0,9.0,29.0,,,,,,,,,,,,,0
588,mcdonalds,Bacon Quarter Pounder with Cheese Meal,Quarter Pounder with Cheese,1,0,178,Burgers,"Quarter Pounder with Cheese, Sandwiches",198.0,,g,,510,26.0,12.0,1.5,90.0,1190,40.0,3.0,9.0,29.0,,,,,,,,,,,,,0
589,mcdonalds,Double Bacon Quarter Pounder with Cheese Meal,Double Quarter Pounder with Cheese,1,0,182,Burgers,"Double Quarter Pounder with Cheese, Sandwiches",279.0,,g,,740,42.0,19.0,2.5,155.0,1380,40.0,3.0,9.0,48.0,,,,,,,,,,,,,0
590,mcdonalds,Double Quarter Pounder with Cheese Deluxe Meal,Double Quarter Pounder with Cheese,1,0,182,Burgers,"Double Quarter Pounder with Cheese, Sandwiches",279.0,,g,,740,42.0,19.0,2.5,155.0,1380,40.0,3.0,9.0,48.0,,,,,,,,,,,,,0
591,mcdonalds,6 pc. Chicken McNuggets,Chicken McNuggets (6 piece),1,0,936137,Entrees,"Chicken McNuggets (6 piece), Chicken McNuggets/Chicken Selects Premium Breast Strips/Sauces",97.0,,g,,280,18.0,3.0,0.0,40.0,540,18.0,1.0,0.0,13.0,,,,,,,,,,,,,0
593,mcdonalds,20 pc. Chicken McNuggets,Chicken McNuggets (4 piece),1,0,180252,Entrees,"Chicken McNuggets (4 piece), Chicken McNuggets/Chicken Selects Premium Breast Strips/Sauces",65.0,,g,,190,12.0,2.0,0.0,25.0,360,12.0,1.0,0.0,9.0,,,,,,,,,,,,,0
594,mcdonalds,4 pc. Chicken McNuggets,Chicken McNuggets (4 piece),1,0,180252,Entrees,"Chicken McNuggets (4 piece), Chicken McNuggets/Chicken Selects Premium Breast Strips/Sauces",65.0,,g,,190,12.0,2.0,0.0,25.0,360,12.0,1.0,0.0,9.0,,,,,,,,,,,,,0
596,mcdonalds,6 pc. Chicken McNuggets Meal,Chicken McNuggets (6 piece),1,0,936137,Entrees,"Chicken McNuggets (6 piece), Chicken McNuggets/Chicken Selects Premium Breast Strips/Sauces",97.0,,g,,280,18.0,3.0,0.0,40.0,540,18.0,1.0,0.0,13.0,,,,,,,,,,,,,0
597,mcdonalds,40 pc. Chicken McNuggets,Chicken McNuggets (4 piece),1,0,180252,Entrees,"Chicken McNuggets (4 piece), Chicken McNuggets/Chicken Selects Premium Breast Strips/Sauces",65.0,,g,,190,12.0,2.0,0.0,25.0,360,12.0,1.0,0.0,9.0,,,,,,,,,,,,,0
598,mcdonalds,6 pc. Spicy Chicken McNuggets,Chicken McNuggets (6 piece),1,0,936137,Entrees,"Chicken McNuggets (6 piece), Chicken McNuggets/Chicken Selects Premium Breast Strips/Sauces",97.0,,g,,280,18.0,3.0,0.0,40.0,540,18.0,1.0,0.0,13.0,,,,,,,,,,,,,0
599,mcdonalds,6 pc. Spicy Chicken McNuggets Meal,Chicken McNuggets (6 piece),1,0,936137,Entrees,"Chicken McNuggets (6 piece), Chicken McNuggets/Chicken Selects Premium Breast Strips/Sauces",97.0,,g,,280,18.0,3.0,0.0,40.0,540,18.0,1.0,0.0,13.0,,,,,,,,,,,,,0
602,mcdonalds,20 pc. Spicy Chicken McNuggets,Chicken McNuggets (4 piece),1,0,180252,Entrees,"Chicken McNuggets (4 piece), Chicken McNuggets/Chicken Selects Premium Breast Strips/Sauces",65.0,,g,,190,12.0,2.0,0.0,25.0,360,12.0,1.0,0.0,9.0,,,,,,,,,,,,,0
603,mcdonalds,40 pc. Spicy Chicken McNuggets,Chicken McNuggets (4 piece),1,0,180252,Entrees,"Chicken McNuggets (4 piece), Chicken McNuggets/Chicken Selects Premium Breast Strips/Sauces",65.0,,g,,190,12.0,2.0,0.0,25.0,360,12.0,1.0,0.0,9.0,,,,,,,,,,,,,0
605,mcdonalds,40 pc. Chicken McNuggets,Chicken McNuggets (4 piece),1,0,180252,Entrees,"Chicken McNuggets (4 piece), Chicken McNuggets/Chicken Selects Premium Breast Strips/Sauces",65.0,,g,,190,12.0,2.0,0.0,25.0,360,12.0,1.0,0.0,9.0,,,,,,,,,,,,,0
608,mcdonalds,6 pc. Chicken McNuggets Happy Meal,Chicken McNuggets (6 piece),1,0,936137,Entrees,"Chicken McNuggets (6 piece), Chicken McNuggets/Chicken Selects Premium Breast Strips/Sauces",97.0,,g,,280,18.0,3.0,0.0,40.0,540,18.0,1.0,0.0,13.0,,,,,,,,,,,,,0
609,mcdonalds,4 pc. Chicken McNugget Happy Meal,Chicken McNuggets (4 piece),1,0,180252,Entrees,"Chicken McNuggets (4 piece), Chicken McNuggets/Chicken Selects Premium Breast Strips/Sauces",65.0,,g,,190,12.0,2.0,0.0,25.0,360,12.0,1.0,0.0,9.0,,,,,,,,,,,,,0
610,mcdonalds,Medium Caramel Frappé,Low Fat Caramel Dip,0,1,953290,Toppings & Ingredients,"Low Fat Caramel Dip, Desserts/ Shakes",21.0,,g,,70,0.5,0.0,0.0,5.0,35,15.0,0.0,9.0,0.0,,,,,,,,,,,,,0
611,mcdonalds,Medium Premium Roast Coffee,Premium Crispy Chicken Club Sandwich,0,1,953224,Sandwiches,"Premium Crispy Chicken Club Sandwich, Sandwiches",237.0,,g,,620,29.0,7.0,0.0,70.0,1200,57.0,3.0,11.0,31.0,,,,,,,,,,,,,0
612,mcdonalds,Medium Mocha Frappé,Iced Caramel Mocha (Small),1,0,936143,Beverages,"Iced Caramel Mocha (Small), McCafe Coffees - Whole Milk",12.0,,fl oz,,240,12.0,7.0,0.0,25.0,130,29.0,0.0,26.0,6.0,,,,,,,,,,,,,0
613,mcdonalds,Medium Iced Coffee,Iced Coffee with Sugar Free Vanilla Syrup (Small),0,1,953351,Beverages,"Iced Coffee with Sugar Free Vanilla Syrup (Small), Beverages",8.0,,fl oz,,60,5.0,3.5,0.0,20.0,70,8.0,0.0,1.0,1.0,,,,,,,,,,,,,0
614,mcdonalds,Medium Iced Caramel Mocha,Iced Caramel Mocha (Small),1,0,936143,Beverages,"Iced Caramel Mocha (Small), McCafe Coffees - Whole Milk",12.0,,fl oz,,240,12.0,7.0,0.0,25.0,130,29.0,0.0,26.0,6.0,,,,,,,,,,,,,0
616,mcdonalds,Medium Iced French Vanilla Coffee,Iced Coffee with Sugar Free Vanilla Syrup (Small),0,1,953351,Beverages,"Iced Coffee with Sugar Free Vanilla Syrup (Small), Beverages",8.0,,fl oz,,60,5.0,3.5,0.0,20.0,70,8.0,0.0,1.0,1.0,,,,,,,,,,,,,0
617,mcdonalds,Medium Iced Caramel Coffee,Iced Caramel Latte (Small),1,0,180275,Beverages,"Iced Caramel Latte (Small), McCafe Coffees - Whole Milk",12.0,,fl oz,,160,3.0,1.5,0.0,10.0,100,29.0,0.0,29.0,3.0,,,,,,,,,,,,,0
618,mcdonalds,Medium Iced Sugar Free Vanilla Coffee,Iced Coffee with Sugar Free Vanilla Syrup (Small),0,1,953351,Beverages,"Iced Coffee with Sugar Free Vanilla Syrup (Small), Beverages",8.0,,fl oz,,60,5.0,3.5,0.0,20.0,70,8.0,0.0,1.0,1.0,,,,,,,,,,,,,0
619,mcdonalds,Medium Iced Caramel Macchiato,Iced Caramel Latte (Small),1,0,180275,Beverages,"Iced Caramel Latte (Small), McCafe Coffees - Whole Milk",12.0,,fl oz,,160,3.0,1.5,0.0,10.0,100,29.0,0.0,29.0,3.0,,,,,,,,,,,,,0
620,mcdonalds,Medium Iced Sugar Free Vanilla Latte,Iced Latte with Sugar Free Vanilla Syrup (Small),0,1,953439,Beverages,"Iced Latte with Sugar Free Vanilla Syrup (Small), McCafe Coffees - Whole Milk",12.0,,fl oz,,60,3.0,2.0,0.0,10.0,80,12.0,0.0,4.0,3.0,,,,,,,,,,,,,0
621,mcdonalds,Medium Iced Caramel Latte,Iced Caramel Latte (Small),1,0,180275,Beverages,"Iced Caramel Latte (Small), McCafe Coffees - Whole Milk",12.0,,fl oz,,160,3.0,1.5,0.0,10.0,100,29.0,0.0,29.0,3.0,,,,,,,,,,,,,0
623,mcdonalds,Medium Iced Mocha,Iced Mocha (Medium),1,0,180268,Beverages,"Iced Mocha (Medium), McCafe Coffees - Whole Milk",16.0,,fl oz,,310,13.0,8.0,0.0,25.0,140,42.0,0.0,35.0,7.0,,,,,,,,,,,,,0
624,mcdonalds,Medium Iced Hazelnut Latte,Iced Hazelnut Latte (Small),0,1,953433,Beverages,"Iced Hazelnut Latte (Small), McCafe Coffees - Whole Milk",12.0,,fl oz,,160,3.0,1.5,0.0,10.0,45,31.0,0.0,31.0,3.0,,,,,,,,,,,,,0
625,mcdonalds,Medium Iced Latte,Iced Latte (Small),1,0,175024,Beverages,"Iced Latte (Small), McCafe Coffees - Whole Milk",12.0,,fl oz,,80,4.5,2.5,0.0,15.0,65,6.0,0.0,6.0,4.0,,,,,,,,,,,,,0
626,mcdonalds,Medium Hot Tea,Baked Hot Apple Pie,1,0,3695,Desserts,"Baked Hot Apple Pie, Desserts/ Shakes",77.0,,g,,250,13.0,7.0,0.0,0.0,170,32.0,4.0,13.0,2.0,,,,,,,,,,,,,0
627,mcdonalds,Medium Caramel Latte,Caramel Latte (Large),1,0,175012,Beverages,"Caramel Latte (Large), McCafe Coffees - Whole Milk",20.0,,fl oz,,330,9.0,5.0,0.0,30.0,210,52.0,0.0,51.0,9.0,,,,,,,,,,,,,0
628,mcdonalds,Medium Caramel Mocha,Caramel Mocha (Small),1,0,154426,Beverages,"Caramel Mocha (Small), McCafe Coffees - Whole Milk",12.0,,fl oz,,250,11.0,6.0,0.0,25.0,150,33.0,0.0,31.0,7.0,,,,,,,,,,,,,0
629,mcdonalds,Medium Iced French Vanilla Latte,Iced Vanilla Latte (Small),0,1,953436,Beverages,"Iced Vanilla Latte (Small), McCafe Coffees - Whole Milk",12.0,,fl oz,,160,3.0,1.5,0.0,10.0,45,31.0,0.0,31.0,3.0,,,,,,,,,,,,,0
631,mcdonalds,Medium Caramel Macchiato,Low Fat Caramel Dip,0,1,953290,Toppings & Ingredients,"Low Fat Caramel Dip, Desserts/ Shakes",21.0,,g,,70,0.5,0.0,0.0,5.0,35,15.0,0.0,9.0,0.0,,,,,,,,,,,,,0
633,mcdonalds,Medium Hazelnut Cappuccino,Hazelnut Cappuccino (Small),0,1,953413,Beverages,"Hazelnut Cappuccino (Small), McCafe Coffees - Whole Milk",12.0,,fl oz,,200,5.0,3.0,0.0,15.0,70,34.0,0.0,34.0,5.0,,,,,,,,,,,,,0
634,mcdonalds,Medium Sugar Free Vanilla latte,Latte with Sugar Free Vanilla Syrup (Small),0,1,953428,Beverages,"Latte with Sugar Free Vanilla Syrup (Small), McCafe Coffees - Whole Milk",12.0,,fl oz,,130,7.0,4.0,0.0,20.0,125,17.0,0.0,10.0,7.0,,,,,,,,,,,,,0
635,mcdonalds,Medium Iced Hazelnut Coffee,Iced Hazelnut Latte (Small),0,1,953433,Beverages,"Iced Hazelnut Latte (Small), McCafe Coffees - Whole Milk",12.0,,fl oz,,160,3.0,1.5,0.0,10.0,45,31.0,0.0,31.0,3.0,,,,,,,,,,,,,0
636,mcdonalds,Medium Premium Hot Chocolate,Hot Chocolate (Large),1,0,180285,Beverages,"Hot Chocolate (Large), McCafe Coffees - Whole Milk",20.0,,fl oz,,460,18.0,10.0,0.5,40.0,220,63.0,0.0,54.0,13.0,,,,,,,,,,,,,0
637,mcdonalds,Medium Latte,Iced Latte (Small),1,0,175024,Beverages,"Iced Latte (Small), McCafe Coffees - Whole Milk",12.0,,fl oz,,80,4.5,2.5,0.0,15.0,65,6.0,0.0,6.0,4.0,,,,,,,,,,,,,0
638,mcdonalds,Medium Hazelnut Latte,Hazelnut Latte (Small),0,1,953416,Beverages,"Hazelnut Latte (Small), McCafe Coffees - Whole Milk",12.0,,fl oz,,230,7.0,4.0,0.0,20.0,90,36.0,0.0,36.0,7.0,,,,,,,,,,,,,0
639,mcdonalds,Medium Vanilla Cappuccino,Vanilla Cappuccino (Small),0,1,953419,Beverages,"Vanilla Cappuccino (Small), McCafe Coffees - Whole Milk",12.0,,fl oz,,200,5.0,3.0,0.0,15.0,70,34.0,0.0,34.0,5.0,,,,,,,,,,,,,0
640,mcdonalds,Medium Sugarfree Vanilla Cappuccino,Vanilla Cappuccino (Small),0,1,953419,Beverages,"Vanilla Cappuccino (Small), McCafe Coffees - Whole Milk",12.0,,fl oz,,200,5.0,3.0,0.0,15.0,70,34.0,0.0,34.0,5.0,,,,,,,,,,,,,0
641,mcdonalds,Medium Caramel Cappuccino,Caramel Cappuccino (Large),1,0,175009,Beverages,"Caramel Cappuccino (Large), McCafe Coffees - Whole Milk",20.0,,fl oz,,290,8.0,4.5,0.0,25.0,190,49.0,0.0,49.0,8.0,,,,,,,,,,,,,0
642,mcdonalds,Medium Pumpkin Latte,Iced Nonfat Latte (Small),0,1,953390,Beverages,"Iced Nonfat Latte (Small), McCafe Coffees - Nonfat Milk",12.0,,fl oz,,50,0.0,0.0,0.0,5.0,70,7.0,0.0,7.0,5.0,,,,,,,,,,,,,0
643,mcdonalds,Apple Pie,Baked Hot Apple Pie,1,0,3695,Desserts,"Baked Hot Apple Pie, Desserts/ Shakes",77.0,,g,,250,13.0,7.0,0.0,0.0,170,32.0,4.0,13.0,2.0,,,,,,,,,,,,,0
644,mcdonalds,Apple & Cookies & Creme Pie,Baked Hot Apple Pie,1,0,3695,Desserts,"Baked Hot Apple Pie, Desserts/ Shakes",77.0,,g,,250,13.0,7.0,0.0,0.0,170,32.0,4.0,13.0,2.0,,,,,,,,,,,,,0
645,mcdonalds,Pumpkin & Creme Pie,"Bacon, Egg & Cheese Bagel",1,0,19154,Sandwiches,"Bacon, Egg & Cheese Bagel, Breakfast",185.0,,g,,560,27.0,9.0,0.5,260.0,1300,56.0,3.0,7.0,24.0,,,,,,,,,,,,,0
646,mcdonalds,Apple & Pumpkin & Creme Pie,Baked Hot Apple Pie,1,0,3695,Desserts,"Baked Hot Apple Pie, Desserts/ Shakes",77.0,,g,,250,13.0,7.0,0.0,0.0,170,32.0,4.0,13.0,2.0,,,,,,,,,,,,,0
647,mcdonalds,Sweet N Sour Dipping Sauce,Sweet 'N Sour Sauce,0,1,953245,Toppings & Ingredients,"Sweet 'N Sour Sauce, Chicken McNuggets/Chicken Selects Premium Breast Strips/Sauces",28.0,,g,,50,0.0,0.0,0.0,0.0,150,12.0,0.0,10.0,0.0,,,,,,,,,,,,,0
648,mcdonalds,Tangy BBQ Dipping Sauce,Tangy Honey Mustard Sauce,0,1,953250,Toppings & Ingredients,"Tangy Honey Mustard Sauce, Chicken McNuggets/Chicken Selects Premium Breast Strips/Sauces",35.0,,g,,60,2.0,0.0,0.0,5.0,140,10.0,0.0,8.0,0.0,,,,,,,,,,,,,0
649,mcdonalds,Creamy Ranch Sauce,Creamy Ranch Sauce,0,1,953249,Toppings & Ingredients,"Creamy Ranch Sauce, Chicken McNuggets/Chicken Selects Premium Breast Strips/Sauces",35.0,,g,,170,18.0,3.0,0.0,10.0,270,2.0,0.0,1.0,0.0,,,,,,,,,,,,,0
650,mcdonalds,Spicy Buffalo,Spicy Buffalo Sauce,0,1,953248,Toppings & Ingredients,"Spicy Buffalo Sauce, Chicken McNuggets/Chicken Selects Premium Breast Strips/Sauces",35.0,,g,,60,6.0,1.0,0.0,0.0,800,1.0,1.0,0.0,0.0,,,,,,,,,,,,,0
651,mcdonalds,Honey Mustard,Tangy Honey Mustard Sauce,0,1,953250,Toppings & Ingredients,"Tangy Honey Mustard Sauce, Chicken McNuggets/Chicken Selects Premium Breast Strips/Sauces",35.0,,g,,60,2.0,0.0,0.0,5.0,140,10.0,0.0,8.0,0.0,,,,,,,,,,,,,0
652,mcdonalds,Syrup,Hotcake Syrup,0,1,953284,Toppings & Ingredients,"Hotcake Syrup, Breakfast",60.0,,g,,180,0.0,0.0,0.0,0.0,20,45.0,0.0,32.0,0.0,,,,,,,,,,,,,0
653,mcdonalds,Hot Mustard Dipping Sauce,Hot Mustard Sauce,0,1,953244,Toppings & Ingredients,"Hot Mustard Sauce, Chicken McNuggets/Chicken Selects Premium Breast Strips/Sauces",28.0,,g,,60,2.5,0.0,0.0,5.0,250,9.0,2.0,6.0,1.0,,,,,,,,,,,,,0
654,mcdonalds,Ranch Dressing,Newman's Own Ranch Dressing,0,1,953268,Toppings & Ingredients,"Newman's Own Ranch Dressing, Salad Dressings",2.0,,fl oz,,170,15.0,2.5,0.0,20.0,530,9.0,0.0,4.0,1.0,,,,,,,,,,,,,0
655,mcdonalds,Hot Picante Salsa,Baked Hot Apple Pie,1,0,3695,Desserts,"Baked Hot Apple Pie, Desserts/ Shakes",77.0,,g,,250,13.0,7.0,0.0,0.0,170,32.0,4.0,13.0,2.0,,,,,,,,,,,,,0
656,mcdonalds,Southwest Dressing,Newman's Own Creamy Southwest Dressing,0,1,953264,Toppings & Ingredients,"Newman's Own Creamy Southwest Dressing, Salad Dressings",2.0,,fl oz,,100,6.0,1.0,0.0,20.0,340,11.0,0.0,3.0,1.0,,,,,,,,,,,,,0
657,mcdonalds,Grape Jam,Grape Jam,0,1,953286,Toppings & Ingredients,"Grape Jam, Breakfast",14.0,,g,,35,0.0,0.0,0.0,0.0,0,9.0,0.0,9.0,0.0,,,,,,,,,,,,,0
658,mcdonalds,Sugar Packet,Sugar Packet,0,1,953340,Toppings & Ingredients,"Sugar Packet, Beverages",4.0,,g,,15,0.0,0.0,0.0,0.0,0,4.0,0.0,4.0,0.0,,,,,,,,,,,,,0
659,mcdonalds,3 Half Strips Bacon,Chicken Selects Premium Breast Strips  (3 pc),0,1,953246,Entrees,"Chicken Selects Premium Breast Strips  (3 pc), Chicken McNuggets/Chicken Selects Premium Breast Strips/Sauces",131.0,,g,,400,24.0,3.5,0.0,50.0,1010,23.0,0.0,0.0,23.0,,,,,,,,,,,,,0
660,mcdonalds,Apple Pie,Baked Hot Apple Pie,1,0,3695,Desserts,"Baked Hot Apple Pie, Desserts/ Shakes",77.0,,g,,250,13.0,7.0,0.0,0.0,170,32.0,4.0,13.0,2.0,,,,,,,,,,,,,0
661,mcdonalds,OREO McFlurry,Snack Size McFlurry with OREO Cookies,0,1,953309,Desserts,"Snack Size McFlurry with OREO Cookies, Desserts/ Shakes",190.0,,g,,340,12.0,6.0,0.0,30.0,200,53.0,2.0,43.0,8.0,,,,,,,,,,,,,0
662,mcdonalds,Medium Strawberry Shake,Strawberry McCafé Shake (12 fl oz cup),0,1,953310,Beverages,"Strawberry McCafé Shake (12 fl oz cup), Desserts/ Shakes",340.0,,g,,570,17.0,10.0,1.0,50.0,170,92.0,0.0,79.0,11.0,,,,,,,,,,,,,0
663,mcdonalds,Hot Fudge Sundae,Hot Fudge Sundae,1,0,62321,Desserts,"Hot Fudge Sundae, Desserts/ Shakes",179.0,,g,,330,10.0,7.0,0.0,25.0,180,54.0,2.0,48.0,8.0,,,,,,,,,,,,,0
664,mcdonalds,Medium Vanilla Shake,Vanilla McCafé Shake (12 fl oz cup),0,1,953317,Beverages,"Vanilla McCafé Shake (12 fl oz cup), Desserts/ Shakes",323.0,,g,,540,16.0,10.0,1.0,45.0,170,88.0,0.0,64.0,10.0,,,,,,,,,,,,,0
665,mcdonalds,Medium Chocolate Shake,Chocolate McCafé Shake (12 fl oz cup),0,1,953301,Beverages,"Chocolate McCafé Shake (12 fl oz cup), Desserts/ Shakes",332.0,,g,,580,17.0,10.0,1.0,50.0,240,94.0,1.0,77.0,11.0,,,,,,,,,,,,,0
666,mcdonalds,Plain Sundae,Hot Fudge Sundae,1,0,62321,Desserts,"Hot Fudge Sundae, Desserts/ Shakes",179.0,,g,,330,10.0,7.0,0.0,25.0,180,54.0,2.0,48.0,8.0,,,,,,,,,,,,,0
667,mcdonalds,Apple & Cookies & Creme Pie,Baked Hot Apple Pie,1,0,3695,Desserts,"Baked Hot Apple Pie, Desserts/ Shakes",77.0,,g,,250,13.0,7.0,0.0,0.0,170,32.0,4.0,13.0,2.0,,,,,,,,,,,,,0
668,mcdonalds,Pumpkin & Creme Pie,"Bacon, Egg & Cheese Bagel",1,0,19154,Sandwiches,"Bacon, Egg & Cheese Bagel, Breakfast",185.0,,g,,560,27.0,9.0,0.5,260.0,1300,56.0,3.0,7.0,24.0,,,,,,,,,,,,,0
669,mcdonalds,Apple & Pumpkin & Creme Pie,Baked Hot Apple Pie,1,0,3695,Desserts,"Baked Hot Apple Pie, Desserts/ Shakes",77.0,,g,,250,13.0,7.0,0.0,0.0,170,32.0,4.0,13.0,2.0,,,,,,,,,,,,,0
670,mcdonalds,Medium Diet Coke,Diet Coke (Small),1,0,19272,Beverages,"Diet Coke (Small), Beverages",16.0,,fl oz,,0,0.0,0.0,0.0,0.0,20,0.0,0.0,0.0,0.0,,,,,,,,,,,,,0
671,mcdonalds,Medium Coke,Diet Coke (Small),1,0,19272,Beverages,"Diet Coke (Small), Beverages",16.0,,fl oz,,0,0.0,0.0,0.0,0.0,20,0.0,0.0,0.0,0.0,,,,,,,,,,,,,0
673,mcdonalds,Bottled Orange Juice,Minute Maid Orange Juice (Small),0,1,953326,Beverages,"Minute Maid Orange Juice (Small), Beverages",12.0,,fl oz,,150,0.0,0.0,0.0,0.0,0,30.0,0.0,30.0,2.0,,,,,,,,,,,,,0
674,mcdonalds,Medium Strawberry Banana Smoothie,Strawberry Banana Smoothie (Small),1,0,19443,Beverages,"Strawberry Banana Smoothie (Small), McCafe Smoothies",12.0,,fl oz,,210,0.5,0.0,0.0,5.0,35,49.0,2.0,44.0,2.0,,,,,,,,,,,,,0
675,mcdonalds,DASANI Bottled Water,Dasani Water,0,1,953325,Beverages,"Dasani Water, Beverages",16.9,,fl oz,,0,0.0,0.0,0.0,0.0,0,0.0,0.0,0.0,0.0,,,,,,,,,,,,,0
676,mcdonalds,Medium Hi-C Orange,Hi-C Orange Lavaburst (Child),0,1,953329,Beverages,"Hi-C Orange Lavaburst (Child), Beverages",12.0,,fl oz,,120,0.0,0.0,0.0,0.0,0,32.0,0.0,32.0,0.0,,,,,,,,,,,,,0
677,mcdonalds,Medium Sweet Iced Tea,Iced Tea (Small),1,0,19279,Beverages,"Iced Tea (Small), Beverages",16.0,,fl oz,,0,0.0,0.0,0.0,0.0,10,0.0,0.0,0.0,0.0,,,,,,,,,,,,,0
678,mcdonalds,Medium Fanta Strawberry,Strawberry Banana Smoothie (Small),1,0,19443,Beverages,"Strawberry Banana Smoothie (Small), McCafe Smoothies",12.0,,fl oz,,210,0.5,0.0,0.0,5.0,35,49.0,2.0,44.0,2.0,,,,,,,,,,,,,0
679,mcdonalds,Medium Fanta Orange,Hi-C Orange Lavaburst (Child),0,1,953329,Beverages,"Hi-C Orange Lavaburst (Child), Beverages",12.0,,fl oz,,120,0.0,0.0,0.0,0.0,0,32.0,0.0,32.0,0.0,,,,,,,,,,,,,0
